country,policy_financing_period_start,name,policy_status,policy_target,policy_implementation_period_end_year,jurisdiction,policy_financing_period_start,policy_financing_quantity,policy_implementation_period_start_year,related_documents,policy_type,impact_on_eu_ets_esd_or_lulucf_emissions,total_ghg_emissions_reductions_in_2020,total_ghg_emissions_reductions_in_2030,agency,related_to_eu_policy_boolean,related_to_eu_policy,ghgs_affected,description,link,data_source,world_region,country_region,city,policy_written_year,impact_evaluation,policy_financing_period_end,percent_private_funded,related_to_neeap_policy,related_to_neeap_policy_boolean
Peru,1997,Gallito Ciego Power Plant,Operational,Energy,,..,1997,0.0,1997,,,,,,,,,,,,,,,,,,,,,
Peru,1998,Yanango - Chimay Power Project,Operational,Energy,,..,1998,60.0,1998,,,,,,,,,,,,,,,,,,,,,
Peru,1998,Yanango - Chimay Power Project,Operational,Energy,,..,2000,140.0,2000,,,,,,,,,,,,,,,,,,,,,
Peru,2001,Empresa de Electricidad de los Andes SA,Operational,Energy,,..,2001,227.0,2001,,,,,,,,,,,,,,,,,,,,,
Peru,2002,Poechos I and II,Operational,Energy,,..,2002,16.3,2002,,,,,,,,,,,,,,,,,,,,,
Peru,2002,Poechos I and II,Operational,Energy,,..,2009,14.0,2009,,,,,,,,,,,,,,,,,,,,,
Peru,2004,Yuncan Hydroelectric Plant,Operational,Energy,2035,Federal,2004,205.0,2004,,,,,,,,,,,,,,,,,,,,,
Peru,2007,El Platanal Hydroelectric Plant,Operational,Energy,,Federal,2007,220.0,2007,,,,,,,,,,,,,,,,,,,,,
Peru,2009,La Joya Hydroelectric Plant,Operational,Energy,Not Available,Federal,2009,30.7,2009,,,,,,,,,,,,,,,,,,,,,
Peru,2010,Cheves Hydropower Project,Construction,Energy,,Federal,2010,253.0,2010,,,,,,,,,,,,,,,,,,,,,
Peru,2010,Maple Energy Ethanol Co-generation Facility,Construction,Energy,Not Applicable,Federal,2010,74.0,2010,,,,,,,,,,,,,,,,,,,,,
Peru,2011,Grupo T Arequipa Solar Plant,Operational,Energy,2032,Federal,2011,87.3,2011,,,,,,,,,,,,,,,,,,,,,
Peru,2011,Grupo T Reparticion Solar Plant,Operational,Energy,2032,Federal,2011,87.3,2011,,,,,,,,,,,,,,,,,,,,,
Peru,2012,Conduit Panamericana/Tacna Solar Plant,Construction,Energy,2032,Federal,2012,210.0,2012,,,,,,,,,,,,,,,,,,,,,
Peru,2012,Inkia - Cerro del Aguila,Construction,Energy,2030,Federal,2012,905.0,2012,,,,,,,,,,,,,,,,,,,,,
Uruguay,2012,Abengoa - Palmaitir Wind Farm,Construction,Energy,2034,Federal,2012,144.0,2012,,,,,,,,,,,,,,,,,,,,,
Uruguay,2012,IMPSA Libertador I Wind Farm,Construction,Energy,2033,Federal,2012,2177.0,2012,,,,,,,,,,,,,,,,,,,,,
"Egypt, Arab Rep.",2010,Kuraymat Solar/CCNG Plant,Operational,Energy,,..,2010,314.7,2010,,,,,,,,,,,,,,,,,,,,,
"Iran, Islamic Rep.",2007,Yazd Solar/CCNG Plant,Operational,Energy,,Federal,2007,158.2,2007,,,,,,,,,,,,,,,,,,,,,
Morocco,1997,Tetouan Wind Power Project,Operational,Energy,2017,..,1997,60.0,1997,,,,,,,,,,,,,,,,,,,,,
Morocco,2011,Nareva El Oued/Haouma/Akfhenir Wind Farm,Construction,Energy,2033,Federal,2011,85.0,2011,,,,,,,,,,,,,,,,,,,,,
Morocco,2012,Nareva Tarfaya Wind Farm,Construction,Energy,2034,Federal,2012,467.0,2012,,,,,,,,,,,,,,,,,,,,,
Morocco,2012,Ouarzazate Solar Phase I,Construction,Energy,2039,Federal,2012,1438.0,2012,,,,,,,,,,,,,,,,,,,,,
Bangladesh,2006,WWR Dhaka Biomass Plant,Operational,Energy,Not Available,Federal,2006,9.0,2006,,,,,,,,,,,,,,,,,,,,,
Bhutan,2009,Dagachhu Hydro Power Project,Construction,Energy,Not Applicable,Federal,2009,201.0,2009,,,,,,,,,,,,,,,,,,,,,
India,1992,Bhoruka Power Co. Ltd. (Shivpur HEP),Operational,Energy,,..,1992,6.5,1992,,,,,,,,,,,,,,,,,,,,,
India,1992,Bhoruka Power Co. Ltd. (Shivpur HEP),Operational,Energy,,..,1995,0.0,1995,,,,,,,,,,,,,,,,,,,,,
India,1992,Bhoruka Power Co. Ltd. (Shivpur HEP),Operational,Energy,,..,1998,0.0,1998,,,,,,,,,,,,,,,,,,,,,
India,1992,Bhoruka Power Co. Ltd. (Shivpur HEP),Operational,Energy,,..,2001,0.0,2001,,,,,,,,,,,,,,,,,,,,,
India,1992,Bhoruka Power Co. Ltd. (Shivpur HEP),Operational,Energy,,..,2003,0.0,2003,,,,,,,,,,,,,,,,,,,,,
India,1992,Bhoruka Power Co. Ltd. (Shivpur HEP),Operational,Energy,,..,2004,0.0,2004,,,,,,,,,,,,,,,,,,,,,
India,1992,Bhoruka Power Co. Ltd. (Shivpur HEP),Operational,Energy,,..,2006,0.0,2006,,,,,,,,,,,,,,,,,,,,,
India,1992,Carborundum Universal Ltd (Maniyar HEP),Operational,Energy,,..,1992,6.9,1992,,,,,,,,,,,,,,,,,,,,,
India,1994,Jaiprakash Hydropower Ltd.,Operational,Energy,,..,1994,311.3,1994,,,,,,,,,,,,,,,,,,,,,
India,1995,Thiru Arooran Sugars Ltd.,Operational,Energy,,..,1995,14.3,1995,,,,,,,,,,,,,,,,,,,,,
India,1999,Bhandaradara Small Hydro Project,Operational,Energy,2029,..,1999,13.3,1999,,,,,,,,,,,,,,,,,,,,,
India,2000,Malana Hydro Electric Power Plant,Operational,Energy,,State/Provincial,2000,77.88,2000,,,,,,,,,,,,,,,,,,,,,
India,2001,Roshni Powertech biomass,Operational,Energy,Not Available,State/Provincial,2001,4.7,2001,,,,,,,,,,,,,,,,,,,,,
India,2002,Greenko Energies Private Limited Sattenpalli and Kadapa Units,Operational,Energy,,..,2002,4.5,2002,,,,,,,,,,,,,,,,,,,,,
India,2002,Greenko Energies Private Limited Sattenpalli and Kadapa Units,Operational,Energy,,..,2004,4.5,2004,,,,,,,,,,,,,,,,,,,,,
India,2002,Rithwik Power Plant,Operational,Energy,2022,State/Provincial,2002,6.0,2002,,,,,,,,,,,,,,,,,,,,,
India,2003,Clarion Power Plant,Operational,Energy,2024,State/Provincial,2003,10.1,2003,,,,,,,,,,,,,,,,,,,,,
India,2003,Dharmshala Hydro Power Limited (DHPL),Operational,Energy,,State/Provincial,2003,6.5,2003,,,,,,,,,,,,,,,,,,,,,
India,2003,Dharmshala Hydro Power Limited (DHPL),Operational,Energy,,State/Provincial,2009,7.0,2009,,,,,,,,,,,,,,,,,,,,,
India,2003,Raghu Rama Renewable Energy Limited (RRREL),Operational,Energy,,..,2003,13.0,2003,,,,,,,,,,,,,,,,,,,,,
India,2003,Vishnuprayag Hydroelectric Project,Construction,Energy,2036,State/Provincial,2003,408.14,2003,,,,,,,,,,,,,,,,,,,,,
India,2004,Chayadevi Hydro Power Scheme,Operational,Energy,Not Available,..,2004,17.7,2004,,,,,,,,,,,,,,,,,,,,,
India,2004,Dehar and Upper Awa SHPs,Operational,Energy,Not Available,State/Provincial,2004,6.0,2004,,,,,,,,,,,,,,,,,,,,,
India,2004,Dehar and Upper Awa SHPs,Operational,Energy,Not Available,State/Provincial,2008,12.0,2008,,,,,,,,,,,,,,,,,,,,,
India,2004,Enercon Wind farms (Jaisalmer) Private Limited,Operational,Energy,,State/Provincial,2004,26.48,2004,,,,,,,,,,,,,,,,,,,,,
India,2004,Hemavathy Small Hydro Project,Operational,Energy,2019,State/Provincial,2004,24.0,2004,,,,,,,,,,,,,,,,,,,,,
India,2005,Chunchi Doddi Mini Hydel Scheme,Operational,Energy,Not Available,..,2005,12.3,2005,,,,,,,,,,,,,,,,,,,,,
India,2005,Ind-Barath Energies Thoothukudi Limited (IBETL),Operational,Energy,,Federal,2005,15.0,2005,,,,,,,,,,,,,,,,,,,,,
India,2005,Middle and Lower Kolab Hydro Electric Project,Construction,Energy,2037,..,2005,33.3,2005,,,,,,,,,,,,,,,,,,,,,
India,2005,Ravikiran Power project,Operational,Energy,Not Available,..,2005,5.5,2005,,,,,,,,,,,,,,,,,,,,,
India,2005,Samal Hydro Electric Project,Construction,Energy,2037,State/Provincial,2005,24.69,2005,,,,,,,,,,,,,,,,,,,,,
India,2006,Allain Duhangan Hydro Electric Project,Operational,Energy,,State/Provincial,2006,230.58,2006,,,,,,,,,,,,,,,,,,,,,
India,2006,Budhil Hydroelectric Project,Construction,Energy,2048,State/Provincial,2006,92.47,2006,,,,,,,,,,,,,,,,,,,,,
India,2006,Drinidhar Power Project,Construction,Energy,2048,State/Provincial,2006,6.35,2006,,,,,,,,,,,,,,,,,,,,,
India,2006,Ecofren Power and ISA Biomass Power Plant,Operational,Energy,2016,State/Provincial,2006,12.8,2006,,,,,,,,,,,,,,,,,,,,,
India,2006,Karcham Wangtoo Hydroelectric Project,Operational,Energy,2036,State/Provincial,2006,1260.0,2006,,,,,,,,,,,,,,,,,,,,,
India,2006,Maheshwar Hydro Power Project,Construction,Energy,,State/Provincial,2006,612.3,2006,,,,,,,,,,,,,,,,,,,,,
India,2006,Malana II Hydro Electric Project,Construction,Energy,2046,State/Provincial,2006,149.5,2006,,,,,,,,,,,,,,,,,,,,,
India,2006,Sorang Hydro Power project,Construction,Energy,2046,..,2006,145.0,2006,,,,,,,,,,,,,,,,,,,,,
India,2006,Surajbari Private Limited,Operational,Energy,,State/Provincial,2006,13.6,2006,,,,,,,,,,,,,,,,,,,,,
India,2006,Upper Khauli Power Project,Construction,Energy,2048,State/Provincial,2006,6.35,2006,,,,,,,,,,,,,,,,,,,,,
India,2006,Vamshi Hydro Power Project,Construction,Energy,2048,State/Provincial,2006,12.27,2006,,,,,,,,,,,,,,,,,,,,,
India,2007,Alaknanda Hydro Power Co Ltd,Construction,Energy,,..,2007,500.0,2007,,,,,,,,,,,,,,,,,,,,,
India,2007,Chuzachen Hydro Power Project,Construction,Energy,2042,State/Provincial,2007,112.19,2007,,,,,,,,,,,,,,,,,,,,,
India,2007,Ind-Barath Energies Maharashtra Limited (IBEML),Operational,Energy,,..,2007,18.3,2007,,,,,,,,,,,,,,,,,,,,,
India,2007,Ind-Barath Power Infra Limited,Operational,Energy,,..,2007,1.03,2007,,,,,,,,,,,,,,,,,,,,,
India,2007,Khandke Wind Farm,Operational,Energy,,State/Provincial,2007,67.0,2007,,,,,,,,,,,,,,,,,,,,,
India,2007,Manjanadka Mini Hydro Project,Operational,Energy,,..,2007,10.0,2007,,,,,,,,,,,,,,,,,,,,,
India,2007,Shrinagar Hydro Electric Project,Construction,Energy,2056,State/Provincial,2007,517.25,2007,,,,,,,,,,,,,,,,,,,,,
India,2007,Teesta III Hydro Electric Project,Construction,Energy,2042,State/Provincial,2007,1426.38,2007,,,,,,,,,,,,,,,,,,,,,
India,2007,Teesta VI Hydro Electric Project,Construction,Energy,2046,State/Provincial,2007,750.0,2007,,,,,,,,,,,,,,,,,,,,,
India,2008,Belgaum Wind Farm,Operational,Energy,,..,2008,33.5,2008,,,,,,,,,,,,,,,,,,,,,
India,2008,Bhoruka Power,Operational,Energy,Not Available,State/Provincial,2008,12.0,2008,,,,,,,,,,,,,,,,,,,,,
India,2008,Dadupur Hydel Power Project,Operational,Energy,,State/Provincial,2008,10.3,2008,,,,,,,,,,,,,,,,,,,,,
India,2008,Patikari Power Private Limited,Operational,Energy,,..,2008,2.3,2008,,,,,,,,,,,,,,,,,,,,,
India,2008,Perla Mini Hydel Project,Operational,Energy,,State/Provincial,2008,23.5,2008,,,,,,,,,,,,,,,,,,,,,
India,2008,Punjab Biomass Power Ltd,Construction,Energy,2028,State/Provincial,2008,13.0,2008,,,,,,,,,,,,,,,,,,,,,
India,2008,Samana and Saundatti Wind Power Project,Operational,Energy,,State/Provincial,2008,237.0,2008,,,,,,,,,,,,,,,,,,,,,
India,2008,Shamburi Mini Hydel Scheme,Operational,Energy,Not Available,State/Provincial,2008,20.1,2008,,,,,,,,,,,,,,,,,,,,,
India,2008,Sidhi Thermal Power Plant,Construction,Energy,2033,State/Provincial,2008,984.0,2008,,,,,,,,,,,,,,,,,,,,,
India,2008,Sonna Mini Hydel Scheme,Operational,Energy,Not Available,State/Provincial,2008,7.8,2008,,,,,,,,,,,,,,,,,,,,,
India,2009,Acciona Wind Energy Private Limited,Operational,Energy,Not Applicable,State/Provincial,2009,45.1,2009,,,,,,,,,,,,,,,,,,,,,
India,2009,Lanco Mandakini Hydro Energy Private Limited - Phata Bhyung HEP,Construction,Energy,2058,State/Provincial,2009,107.4,2009,,,,,,,,,,,,,,,,,,,,,
India,2009,National Hydroelectricity Power Corporation,Operational,Energy,Not Applicable,Federal,2009,826.75,2009,,,,,,,,,,,,,,,,,,,,,
India,2010,Azure Power India (first plants in Punjab and Gujarat),Operational,Energy,,State/Provincial,2010,60.0,2010,,,,,,,,,,,,,,,,,,,,,
India,2010,Caparo Energy Limited,Construction,Energy,,State/Provincial,2010,143.0,2010,,,,,,,,,,,,,,,,,,,,,
India,2010,CLP Theni I wind farm,Operational,Energy,,State/Provincial,2010,65.0,2010,,,,,,,,,,,,,,,,,,,,,
India,2010,Dhonithanda Wind Project Limited,Operational,Energy,,Federal,2010,26.0,2010,,,,,,,,,,,,,,,,,,,,,
India,2010,Indian Energy Theni Project Phase 1,Operational,Energy,,Federal,2010,19.8,2010,,,,,,,,,,,,,,,,,,,,,
India,2010,Kapil Mohan & Associates Hydo Power Pvt. Ltd.,Construction,Energy,2050,State/Provincial,2010,23.0,2010,,,,,,,,,,,,,,,,,,,,,
India,2010,Kumardhara Small Hydel Power Plant,Construction,Energy,Not Available,State/Provincial,2010,27.6,2010,,,,,,,,,,,,,,,,,,,,,
India,2010,L&T Uttaranchal Hydro Power Ltd,Construction,Energy,2055,State/Provincial,2010,227.6,2010,,,,,,,,,,,,,,,,,,,,,
India,2010,NSL Tidong Power Generation Private Limited (NTPGL),Construction,Energy,2053,State/Provincial,2010,143.5,2010,,,,,,,,,,,,,,,,,,,,,
India,2010,SJVN Ltd,Operational,Energy,Not Available,Federal,2010,90.75,2010,,,,,,,,,,,,,,,,,,,,,
India,2010,Tuppadahalli Energy India Private Limited_56MW Windfarm,Operational,Energy,Not Applicable,State/Provincial,2010,71.9,2010,,,,,,,,,,,,,,,,,,,,,
India,2010,Vaayu India Power Corporation Ltd,Construction,Energy,,State/Provincial,2010,256.7,2010,,,,,,,,,,,,,,,,,,,,,
India,2011,Abhijeet Naukh CSP Solar Plant Phase I,Construction,Energy,2037,Federal,2011,185.5,2011,,,,,,,,,,,,,,,,,,,,,
India,2011,Adani Abdasa Solar Plant,Operational,Energy,Not Available,State/Provincial,2011,150.2,2011,,,,,,,,,,,,,,,,,,,,,
India,2011,AES Saurashtra Wind Farm,Construction,Energy,Not Available,State/Provincial,2011,54.8,2011,,,,,,,,,,,,,,,,,,,,,
India,2011,AES Solar Jodhpur Solar Plant,Construction,Energy,Not Available,Federal,2011,19.4,2011,,,,,,,,,,,,,,,,,,,,,
India,2011,AES Solar Patan Solar Plant Phase I & II,Construction,Energy,2037,State/Provincial,2011,44.7,2011,,,,,,,,,,,,,,,,,,,,,
India,2011,Ajanta Pharama Surendranagar Solar Plant,Operational,Energy,2036,State/Provincial,2011,31.3,2011,,,,,,,,,,,,,,,,,,,,,
India,2011,CLP Andhra Wind Farm,Construction,Energy,Not Applicable,State/Provincial,2011,138.2,2011,,,,,,,,,,,,,,,,,,,,,
India,2011,Dahanu Solar Power Private Limited,Operational,Energy,Not Applicable,State/Provincial,2011,150.0,2011,,,,,,,,,,,,,,,,,,,,,
India,2011,ENAM Surel Solar Plant,Operational,Energy,Not Applicable,State/Provincial,2011,70.7,2011,,,,,,,,,,,,,,,,,,,,,
India,2011,Enercon Pithodai Wind Farm,Construction,Energy,2036,State/Provincial,2011,21.9,2011,,,,,,,,,,,,,,,,,,,,,
India,2011,Ganges Green Energy Private Limited,Operational,Energy,Not Applicable,State/Provincial,2011,83.3,2011,,,,,,,,,,,,,,,,,,,,,
India,2011,Genting Jangi Wind Farm,Construction,Energy,Not Applicable,State/Provincial,2011,152.0,2011,,,,,,,,,,,,,,,,,,,,,
India,2011,Greenko Dikchu HPP,Construction,Energy,2046,State/Provincial,2011,158.5,2011,,,,,,,,,,,,,,,,,,,,,
India,2011,Greenko Patan Taluka Wind Farm,Construction,Energy,Not Available,State/Provincial,2011,91.5,2011,,,,,,,,,,,,,,,,,,,,,
India,2011,Hiraco Renewable Energy Private Limited,Operational,Energy,Not Applicable,State/Provincial,2011,66.6,2011,,,,,,,,,,,,,,,,,,,,,
India,2011,INOX Chotila Wind Farm,Operational,Energy,Not Applicable,State/Provincial,2011,64.3,2011,,,,,,,,,,,,,,,,,,,,,
India,2011,Jaihind Chadiyana Solar Plant,Operational,Energy,2037,State/Provincial,2011,16.6,2011,,,,,,,,,,,,,,,,,,,,,
India,2011,Jain Irrigation Shirsoli Solar Plant,Construction,Energy,Not Available,Federal,2011,28.2,2011,,,,,,,,,,,,,,,,,,,,,
India,2011,Kiran Charanka Solar Plant,Construction,Energy,2037,State/Provincial,2011,61.2,2011,,,,,,,,,,,,,,,,,,,,,
India,2011,Lanco Chandiyana Solar Plant,Operational,Energy,Not Available,State/Provincial,2011,17.0,2011,,,,,,,,,,,,,,,,,,,,,
India,2011,MEMC Dhama Solar Plant,Construction,Energy,2036,State/Provincial,2011,19.6,2011,,,,,,,,,,,,,,,,,,,,,
India,2011,MEMC Rawara Solar Plant,Operational,Energy,Not Available,Federal,2011,14.6,2011,,,,,,,,,,,,,,,,,,,,,
India,2011,Moser Baer Precious Solar Plant,Operational,Energy,2036,State/Provincial,2011,49.3,2011,,,,,,,,,,,,,,,,,,,,,
India,2011,Moser Baer Solitaire Solar Plant,Operational,Energy,2036,State/Provincial,2011,49.5,2011,,,,,,,,,,,,,,,,,,,,,
India,2011,NSL Pabbar & Supin HPPs,Construction,Energy,Not Available,State/Provincial,2011,71.1,2011,,,,,,,,,,,,,,,,,,,,,
India,2011,Om Power Neogal HPP,Construction,Energy,Not Available,State/Provincial,2011,9.2,2011,,,,,,,,,,,,,,,,,,,,,
India,2011,Roha Dyechem Santalpur Taluka Solar Plant,Construction,Energy,2037,State/Provincial,2011,76.0,2011,,,,,,,,,,,,,,,,,,,,,
India,2011,RPG Kutch Solar Plant,Construction,Energy,2037,State/Provincial,2011,26.7,2011,,,,,,,,,,,,,,,,,,,,,
India,2011,Serum Institute Maharashtra Wind Farm Project,Operational,Energy,Not Applicable,State/Provincial,2011,48.0,2011,,,,,,,,,,,,,,,,,,,,,
India,2011,SEW Bichom HPP,Construction,Energy,Not Available,State/Provincial,2011,193.6,2011,,,,,,,,,,,,,,,,,,,,,
India,2011,Shree Ganesh Charnaka Solar Plant,Construction,Energy,2037,State/Provincial,2011,85.1,2011,,,,,,,,,,,,,,,,,,,,,
India,2011,Simran Amuthapuram Wind Farms,Operational,Energy,2031,State/Provincial,2011,133.3,2011,,,,,,,,,,,,,,,,,,,,,
India,2011,Sonthalia Naukh Solar Plant,Construction,Energy,2037,Federal,2011,15.4,2011,,,,,,,,,,,,,,,,,,,,,
India,2011,Sun Charanka Solar Plant,Operational,Energy,2037,State/Provincial,2011,19.1,2011,,,,,,,,,,,,,,,,,,,,,
India,2011,SunBorne Karmaria I & II Solar Plant,Construction,Energy,2036,State/Provincial,2011,44.5,2011,,,,,,,,,,,,,,,,,,,,,
India,2011,TATA Mithapur Solar Plant,Operational,Energy,2036,State/Provincial,2011,77.5,2011,,,,,,,,,,,,,,,,,,,,,
India,2011,TVS Energy (Maharashtra) Limited_25.5MW Windfarm,Operational,Energy,Not Applicable,State/Provincial,2011,35.1,2011,,,,,,,,,,,,,,,,,,,,,
India,2011,Videocon Jodhpur Solar Plant,Construction,Energy,2037,Federal,2011,19.1,2011,,,,,,,,,,,,,,,,,,,,,
India,2011,Videocon Warora Solar Plant,Construction,Energy,2036,Federal,2011,18.9,2011,,,,,,,,,,,,,,,,,,,,,
India,2012,Beta Wind Farm (Gujarat & Andhra) Private Limited,Construction,Energy,Not Applicable,State/Provincial,2012,183.4,2012,,,,,,,,,,,,,,,,,,,,,
India,2012,Beta Wind Farm (Tamil Nadu) Private Limited,Operational,Energy,Not Applicable,State/Provincial,2012,198.0,2012,,,,,,,,,,,,,,,,,,,,,
India,2012,Bhilwara Green Energy Limited_49.5MW Windfarm,Operational,Energy,Not Applicable,State/Provincial,2012,59.6,2012,,,,,,,,,,,,,,,,,,,,,
India,2012,Bindu Vayu Urja (Chakala) Private Limited,Operational,Energy,Not Applicable,State/Provincial,2012,32.9,2012,,,,,,,,,,,,,,,,,,,,,
India,2012,Bindu Vayu Urja (Jamanvada) Private Limited,Operational,Energy,Not Applicable,State/Provincial,2012,58.7,2012,,,,,,,,,,,,,,,,,,,,,
India,2012,Bindu Vayu Urja (Kaladonger) Private Limited,Operational,Energy,Not Applicable,State/Provincial,2012,0.0,2012,,,,,,,,,,,,,,,,,,,,,
India,2012,BLP Wind Project (Amberi) Private Limited,Operational,Energy,Not Applicable,State/Provincial,2012,33.2,2012,,,,,,,,,,,,,,,,,,,,,
India,2012,Bothe Windfarm Development Private Limited,Construction,Energy,Not Applicable,State/Provincial,2012,244.7,2012,,,,,,,,,,,,,,,,,,,,,
India,2012,CLP (Jaisalmer) Windfarm 102.4MW,Construction,Energy,Not Applicable,State/Provincial,2012,120.0,2012,,,,,,,,,,,,,,,,,,,,,
India,2012,Essel MP Energy Limited,Construction,Energy,Not Applicable,Federal,2012,39.1,2012,,,,,,,,,,,,,,,,,,,,,
India,2012,Fortune Five Hydel Projects Private Limited,Construction,Energy,Not Applicable,State/Provincial,2012,114.3,2012,,,,,,,,,,,,,,,,,,,,,
India,2012,GMR Charanka Solar Plant 25MW,Operational,Energy,Not Applicable,State/Provincial,2012,56.1,2012,,,,,,,,,,,,,,,,,,,,,
India,2012,Godavari Naukh CSP Solar Plant,Construction,Energy,Not Applicable,Federal,2012,148.9,2012,,,,,,,,,,,,,,,,,,,,,
India,2012,Green Infra (Satara) Wind Energy Limited 18MW,Construction,Energy,Not Applicable,State/Provincial,2012,21.4,2012,,,,,,,,,,,,,,,,,,,,,
India,2012,Green Infra (Theni) Wind Energy Limited 25.5MW,Construction,Energy,,State/Provincial,2012,28.7,2012,,,,,,,,,,,,,,,,,,,,,
India,2012,MEIL Green Power (Anantpur) Limited 50MW CSP,Construction,Energy,Not Applicable,Federal,2012,134.7,2012,,,,,,,,,,,,,,,,,,,,,
India,2012,Moser Baer (Porbandar) Solar Project,Operational,Energy,Not Applicable,State/Provincial,2012,34.8,2012,,,,,,,,,,,,,,,,,,,,,
India,2012,Mytrah Energy Limited- 100.3MW Savalsang Wndfarm,Construction,Energy,Not Applicable,State/Provincial,2012,0.0,2012,,,,,,,,,,,,,,,,,,,,,
India,2012,Mytrah Energy Limited- 37.4MW Burgula Wndfarm,Construction,Energy,Not Applicable,State/Provincial,2012,0.0,2012,,,,,,,,,,,,,,,,,,,,,
India,2012,Mytrah Vayu (Pennar) Private Limited,Operational,Energy,Not Applicable,State/Provincial,2012,72.6,2012,,,,,,,,,,,,,,,,,,,,,
India,2012,NSL Wind Power Company (Phoolwadi) Private Limited,Operational,Energy,Not Applicable,State/Provincial,2012,49.4,2012,,,,,,,,,,,,,,,,,,,,,
India,2012,NSL Wind Power Company (Satara) Private Limited,Construction,Energy,Not Applicable,State/Provincial,2012,96.4,2012,,,,,,,,,,,,,,,,,,,,,
India,2012,NuPower Renewables (Tirunelvelli) Windfarm 100.5MW,Operational,Energy,Not Applicable,State/Provincial,2012,133.1,2012,,,,,,,,,,,,,,,,,,,,,
India,2012,Rajasthan Sun Technique Energy Private Limited,Construction,Energy,Not Applicable,Federal,2012,368.3,2012,,,,,,,,,,,,,,,,,,,,,
India,2012,Rayala Wind Power Company Private Limited,Construction,Energy,Not Applicable,State/Provincial,2012,120.5,2012,,,,,,,,,,,,,,,,,,,,,
India,2012,ReNew Wind Energy (Karnataka) Private Limited,Construction,Energy,Not Applicable,State/Provincial,2012,52.2,2012,,,,,,,,,,,,,,,,,,,,,
India,2012,ReNew Wind Energy (Rajkot) Private Limited,Operational,Energy,Not Applicable,State/Provincial,2012,26.3,2012,,,,,,,,,,,,,,,,,,,,,
India,2012,ReNew Wind Energy (Varekarwadi) Private Limited,Construction,Energy,Not Applicable,State/Provincial,2012,31.6,2012,,,,,,,,,,,,,,,,,,,,,
India,2012,ReNew Wind Energy (Vashpet) Windfarm,Operational,Energy,Not Applicable,State/Provincial,2012,59.2,2012,,,,,,,,,,,,,,,,,,,,,
India,2012,SEI Solar Power Jodhpur Solar Project,Construction,Energy,Not Applicable,Federal,2012,50.6,2012,,,,,,,,,,,,,,,,,,,,,
India,2012,SLREPL 25 MW Banskantha Solar Project,Operational,Energy,Not Applicable,State/Provincial,2012,72.7,2012,,,,,,,,,,,,,,,,,,,,,
India,2012,Sunborne Energy Rajasthan Solar Private Limited,Construction,Energy,Not Applicable,Federal,2012,9.9,2012,,,,,,,,,,,,,,,,,,,,,
India,2012,Tadas Wind Energy Limited,Operational,Energy,Not Applicable,State/Provincial,2012,218.5,2012,,,,,,,,,,,,,,,,,,,,,
India,2012,Tata Mithapur Solar Plant,Operational,Energy,Not Applicable,State/Provincial,2012,78.2,2012,,,,,,,,,,,,,,,,,,,,,
India,2012,Torrent Jamnagar Windfarm_49.6 MW,Operational,Energy,Not Applicable,State/Provincial,2012,54.6,2012,,,,,,,,,,,,,,,,,,,,,
India,2012,Torrent Sangli 75MW Windfarm,Construction,Energy,Not Applicable,State/Provincial,2012,97.5,2012,,,,,,,,,,,,,,,,,,,,,
India,2012,Vaayu Renewable Energy (Mahanadi) Private Limited,Construction,Energy,Not Applicable,State/Provincial,2012,30.9,2012,,,,,,,,,,,,,,,,,,,,,
India,2012,Welspun Energy Jodhpur Solar Project 50MW,Operational,Energy,Not Applicable,Federal,2012,90.0,2012,,,,,,,,,,,,,,,,,,,,,
Nepal,1994,Khimti Khola Hydropower Project,Operational,Energy,2044,Federal,1994,125.7,1994,,,,,,,,,,,,,,,,,,,,,
Nepal,1996,Upper Bhote Koshi Hydropower Plant,Operational,Energy,2046,Federal,1996,98.2,1996,,,,,,,,,,,,,,,,,,,,,
Nepal,1998,Himal Upper Bothekoshi SHPP,Construction,Energy,2026,Federal,1998,98.0,1998,,,,,,,,,,,,,,,,,,,,,
Nepal,2000,Indrawati III Power Project,Operational,Energy,,Federal,2000,15.1,2000,,,,,,,,,,,,,,,,,,,,,
Nepal,2003,Arun Valley Piluwa Khola SHPP,Operational,Energy,,Federal,2003,4.35,2003,,,,,,,,,,,,,,,,,,,,,
Nepal,2003,Butwal Power Company (BPC),Operational,Energy,Not Applicable,Federal,2003,0.0,2003,,,,,,,,,,,,,,,,,,,,,
Nepal,2003,Chilime Rasuwa SHPP,Operational,Energy,,Federal,2003,26.2,2003,,,,,,,,,,,,,,,,,,,,,
Nepal,2004,Ridi Rairang SHPP,Operational,Energy,,Federal,2004,0.5,2004,,,,,,,,,,,,,,,,,,,,,
Nepal,2005,Alliance Chaku Khola SHPP,Operational,Energy,,..,2005,2.0,2005,,,,,,,,,,,,,,,,,,,,,
Nepal,2005,Butwal Lower Nyadi SHPP,Operational,Energy,,Federal,2005,6.0,2005,,,,,,,,,,,,,,,,,,,,,
Nepal,2005,Khudi SHPP,Operational,Energy,,Federal,2012,6.5,2012,,,,,,,,,,,,,,,,,,,,,
Nepal,2005,Sanima Sun Koshi SHPP,Operational,Energy,,Federal,2005,3.0,2005,,,,,,,,,,,,,,,,,,,,,
Nepal,2008,DGPC/TATA Dagacchu HPP,Construction,Energy,,Federal,2008,201.5,2008,,,,,,,,,,,,,,,,,,,,,
Nepal,2008,Ridi Ridikhola SHPP,Operational,Energy,,Federal,2008,4.6,2008,,,,,,,,,,,,,,,,,,,,,
Nepal,2010,Nyadi Siuri Khola SHPP,Operational,Energy,,Federal,2010,5.0,2010,,,,,,,,,,,,,,,,,,,,,
Nepal,2010,Sanima Mai Hydropower Project (MHP),Construction,Energy,2045,Federal,2010,34.1,2010,,,,,,,,,,,,,,,,,,,,,
Nepal,2010,Sanima Mai Hydropower Project (MHP),Construction,Energy,2045,Federal,2012,4.5,2012,,,,,,,,,,,,,,,,,,,,,
Nepal,2012,Green Ventures Likhu IV HPP,Construction,Energy,,Federal,2012,262.9,2012,,,,,,,,,,,,,,,,,,,,,
Pakistan,1995,Agrilectric Larkana Power Plant,Operational,Energy,,..,1995,10.0,1995,,,,,,,,,,,,,,,,,,,,,
Pakistan,1995,Japan Power Generation Company,Operational,Energy,,..,1995,120.0,1995,,,,,,,,,,,,,,,,,,,,,
Pakistan,1995,Power Gen Hydro,Operational,Energy,,..,1995,15.0,1995,,,,,,,,,,,,,,,,,,,,,
Pakistan,2007,New Bong Escape Hydropower Project,Construction,Energy,2037,Federal,2007,233.0,2007,,,,,,,,,,,,,,,,,,,,,
Pakistan,2008,Almoiz Bagasse-fired Cogeneration Plant,Operational,Energy,2018,Federal,2008,7.5,2008,,,,,,,,,,,,,,,,,,,,,
Pakistan,2011,Rasul Hydropower Plant,Operational,Energy,2042,State/Provincial,2011,38.3,2011,,,,,,,,,,,,,,,,,,,,,
Pakistan,2012,Fauji Jamphir II Wind Farm,Construction,Energy,,Federal,2012,66.5,2012,,,,,,,,,,,,,,,,,,,,,
Pakistan,2012,Fauji Jhampir I Wind Farm,Construction,Energy,2022,Federal,2012,66.5,2012,,,,,,,,,,,,,,,,,,,,,
Pakistan,2012,Fauji Kuttikun I Wind Farm,Construction,Energy,,Federal,2012,135.0,2012,,,,,,,,,,,,,,,,,,,,,
Pakistan,2012,Fauji Kuttikun II Wind Farm,Construction,Energy,,Federal,2012,135.0,2012,,,,,,,,,,,,,,,,,,,,,
Pakistan,2012,K-Water Star Patrind HPP,Construction,Energy,2046,Federal,2012,436.0,2012,,,,,,,,,,,,,,,,,,,,,
Pakistan,2012,SSJD Sindh Biomass Plant,Construction,Energy,,Federal,2012,16.7,2012,,,,,,,,,,,,,,,,,,,,,
Pakistan,2012,Tapal/Fauji Gharo Wind Farm,Construction,Energy,2032,Federal,2012,126.5,2012,,,,,,,,,,,,,,,,,,,,,
Pakistan,2012,Yunus Jhampir Wind Farm,Construction,Energy,,Federal,2012,70.0,2012,,,,,,,,,,,,,,,,,,,,,
Pakistan,2012,Zorlu Sindh Wind Farm,Construction,Energy,2032,Federal,2012,158.7,2012,,,,,,,,,,,,,,,,,,,,,
Sri Lanka,1995,Hydrotech Lanka Dickoya Mini-Power Plants,Operational,Energy,,..,1995,0.0,1995,,,,,,,,,,,,,,,,,,,,,
Sri Lanka,1995,Strothert Mini-Hydro Power Plants,Operational,Energy,,..,1995,21.7,1995,,,,,,,,,,,,,,,,,,,,,
