country,policy_financing_period_start,name,policy_status,policy_target,policy_implementation_period_end_year,jurisdiction,policy_financing_period_start,policy_financing_quantity,policy_implementation_period_start_year,related_documents,policy_type,impact_on_eu_ets_esd_or_lulucf_emissions,total_ghg_emissions_reductions_in_2020,total_ghg_emissions_reductions_in_2030,agency,related_to_eu_policy_boolean,related_to_eu_policy,ghgs_affected,description,link,data_source,world_region,country_region,city,policy_written_year,impact_evaluation,policy_financing_period_end,percent_private_funded,related_to_neeap_policy,related_to_neeap_policy_boolean
Cambodia,2001,Kirirom 1 and 3 Hydropower Stations,Operational,Energy,2031,Federal,2001,20.0,2001,,,,,,,,,,,,,,,,,,,,,
Cambodia,2001,Kirirom 1 and 3 Hydropower Stations,Operational,Energy,2031,Federal,2008,47.1,2008,,,,,,,,,,,,,,,,,,,,,
Cambodia,2007,ABC Phnom Penh Biomass Plant,Operational,Energy,,Federal,2007,6.33,2007,,,,,,,,,,,,,,,,,,,,,
Cambodia,2007,Kamchay Hydropower Station,Operational,Energy,2050,Federal,2007,280.0,2007,,,,,,,,,,,,,,,,,,,,,
Cambodia,2007,Stung Atay River Hydropower Station,Construction,Energy,2040,Federal,2007,255.3,2007,,,,,,,,,,,,,,,,,,,,,
Cambodia,2010,Orussei Hydroelectric Power Plant,Construction,Energy,2042,Federal,2010,558.0,2010,,,,,,,,,,,,,,,,,,,,,
Cambodia,2010,Stung Russey Chrum Krom Hydropower Plant,Construction,Energy,2045,Federal,2010,412.0,2010,,,,,,,,,,,,,,,,,,,,,
Cambodia,2010,Stung Tatay Hydropower Plant,Construction,Energy,2052,Federal,2010,540.0,2010,,,,,,,,,,,,,,,,,,,,,
China,1993,Leshan Electric Power Co.,Operational,Energy,,..,1993,18.7,1993,,,,,,,,,,,,,,,,,,,,,
China,1994,Hunan Xiangci-AES Hydro Power Co. Ltd.,Operational,Energy,,..,1994,14.0,1994,,,,,,,,,,,,,,,,,,,,,
China,1996,Taicang Xiexing Thermal Power Co.,Operational,Energy,,..,1996,0.0,1996,,,,,,,,,,,,,,,,,,,,,
China,1996,Taicang Xiexing Thermal Power Co.,Operational,Energy,,..,1998,4.8,1998,,,,,,,,,,,,,,,,,,,,,
China,1997,Nuon Nan'ao Wind Farm,Operational,Energy,2017,..,1997,30.0,1997,,,,,,,,,,,,,,,,,,,,,
China,1998,Asia Power Neijiang Hydropower,Operational,Energy,,..,1998,3.2,1998,,,,,,,,,,,,,,,,,,,,,
China,1998,Shengzhou Thermal Power Co.,Operational,Energy,2023,..,1998,10.0,1998,,,,,,,,,,,,,,,,,,,,,
China,1999,Fushi Meiya,Operational,Energy,,..,1999,53.0,1999,,,,,,,,,,,,,,,,,,,,,
China,1999,Guangdong Huaiji Power,Operational,Energy,2029,..,1999,115.7,1999,,,,,,,,,,,,,,,,,,,,,
China,1999,Guangdong Huaiji Power,Operational,Energy,2029,..,2005,115.7,2005,,,,,,,,,,,,,,,,,,,,,
China,1999,Weigang Meiya,Operational,Energy,,..,1999,50.0,1999,,,,,,,,,,,,,,,,,,,,,
China,1999,Zuojiang Meiya,Operational,Energy,,..,1999,62.3,1999,,,,,,,,,,,,,,,,,,,,,
China,2000,Fujian Mindong Electric Power Co.,Operational,Energy,,..,2000,150.0,2000,,,,,,,,,,,,,,,,,,,,,
China,2000,Guangxi Guigan Electric Power,Operational,Energy,,..,2000,83.3,2000,,,,,,,,,,,,,,,,,,,,,
China,2001,Beijing Kangxi Wind Farm Project,Operational,Energy,2031,State/Provincial,2001,241.55,2001,,,,,,,,,,,,,,,,,,,,,
China,2001,Longquan Ruiyang Phase II Hydroelectric Power Plant,Operational,Energy,2051,..,2001,24.1,2001,,,,,,,,,,,,,,,,,,,,,
China,2002,Asia Power Anning River,Operational,Energy,2032,..,2002,38.65,2002,,,,,,,,,,,,,,,,,,,,,
China,2002,Asia Power Sichuan Maoergai Hydropower,Construction,Energy,2032,..,2002,50.08,2002,,,,,,,,,,,,,,,,,,,,,
China,2002,Mianyang - Units 2 and 3,Construction,Energy,2032,..,2002,30.0,2002,,,,,,,,,,,,,,,,,,,,,
China,2002,Qingdao Huawei Wind Farm Project,Operational,Energy,2027,Local,2002,16.84,2002,,,,,,,,,,,,,,,,,,,,,
China,2002,Zhigangkala Hydroelectric Power Plant Project,Operational,Energy,2032,..,2002,171.5,2002,,,,,,,,,,,,,,,,,,,,,
China,2003,Helanshan Wind Farm Project phases I and II,Operational,Energy,2028,Local,2003,11.14,2003,,,,,,,,,,,,,,,,,,,,,
China,2003,Jin'anqiao Hydroelectric Power Plant,Construction,Energy,,..,2003,1691.0,2003,,,,,,,,,,,,,,,,,,,,,
China,2003,Nina Hydroelectric Plant,Operational,Energy,,..,2003,145.0,2003,,,,,,,,,,,,,,,,,,,,,
China,2003,Weixi Tuoluo River Power Plant,Operational,Energy,2053,Local,2003,18.12,2003,,,,,,,,,,,,,,,,,,,,,
China,2003,Yangtze Electric Power Co.,Operational,Energy,,..,2003,1200.0,2003,,,,,,,,,,,,,,,,,,,,,
China,2003,Yongkou Hydro Power Plant,Operational,Energy,2053,..,2003,25.85,2003,,,,,,,,,,,,,,,,,,,,,
China,2004,China Power International Development Ltd.,Operational,Energy,,..,2004,369.0,2004,,,,,,,,,,,,,,,,,,,,,
China,2004,"Dragon Power Co., Ltd.",Operational,Energy,Not Applicable,..,2004,181.0,2004,,,,,,,,,,,,,,,,,,,,,
China,2004,Jiangsu Rudong Wind Power Plant,Construction,Energy,2028,Federal,2004,97.0,2004,,,,,,,,,,,,,,,,,,,,,
China,2004,Qiaohe Cascade One Hydropower Plant Project,Operational,Energy,,..,2004,4.39,2004,,,,,,,,,,,,,,,,,,,,,
China,2004,Yantai City (Changdao) Wind Farm,Operational,Energy,,..,2004,29.8,2004,,,,,,,,,,,,,,,,,,,,,
China,2005,Asia Wind Power (Mudanjiang) Company Limited,Operational,Energy,2075,Local,2005,36.63,2005,,,,,,,,,,,,,,,,,,,,,
China,2005,Datang Ruifeng Shuangliao Wind Farm Project Phase I,Operational,Energy,2035,Local,2005,60.12,2005,,,,,,,,,,,,,,,,,,,,,
China,2005,Gansu Datang Yumen Wind Power Co,Construction,Energy,,Federal,2005,57.5,2005,,,,,,,,,,,,,,,,,,,,,
China,2005,Hong Kong Wind Power (Muling) Company Limited,Operational,Energy,2075,Local,2005,73.26,2005,,,,,,,,,,,,,,,,,,,,,
China,2005,Meida Daishan Wind Farm Project,Operational,Energy,2027,..,2005,51.89,2005,,,,,,,,,,,,,,,,,,,,,
China,2005,Weihai Wind power plant China Light and Power,Construction,Energy,,Local,2005,19.93,2005,,,,,,,,,,,,,,,,,,,,,
China,2006,"Asia Power (Leibo) Hydroelectric Power Co., Ltd.",Operational,Energy,2056,Local,2006,18.63,2006,,,,,,,,,,,,,,,,,,,,,
China,2006,"Asia Power (Yun County) Hydroelectric Power Co., Ltd.",Operational,Energy,2056,Local,2006,12.55,2006,,,,,,,,,,,,,,,,,,,,,
China,2006,Changtu Liaoneng Xiexin Wind Farm Project,Operational,Energy,2026,..,2006,53.95,2006,,,,,,,,,,,,,,,,,,,,,
China,2006,Cixi Wind Farm Project Phase I,Operational,Energy,2026,Local,2006,75.28,2006,,,,,,,,,,,,,,,,,,,,,
China,2006,Diqing Weixi Luoma Hydro Power Plant,Construction,Energy,2056,Local,2006,30.35,2006,,,,,,,,,,,,,,,,,,,,,
China,2006,Guohua Ruifeng (Rongcheng) Wind Farm Project,Operational,Energy,2026,Local,2006,63.11,2006,,,,,,,,,,,,,,,,,,,,,
China,2006,Huangtian Hydro Power Plant,Construction,Energy,,Local,2006,39.65,2006,,,,,,,,,,,,,,,,,,,,,
China,2006,Shandong Linyi Waste-to-Energy Project,Operational,Energy,2036,..,2006,34.88,2006,,,,,,,,,,,,,,,,,,,,,
China,2006,"Tianquan River (Shiyang Section) Hydroelectric Power Development Co., Ltd.",Operational,Energy,2056,..,2006,87.8,2006,,,,,,,,,,,,,,,,,,,,,
China,2006,"Xinjiang Farsighted Yeerqiang River Hydroelectric Power Development Co., Ltd.",Construction,Energy,2056,..,2006,6.27,2006,,,,,,,,,,,,,,,,,,,,,
China,2006,Yun County Nan River Cascade One Hydro Power Plant,Construction,Energy,2045,Local,2006,24.42,2006,,,,,,,,,,,,,,,,,,,,,
China,2007,Bailingmiao Wind Farm Project,Construction,Energy,2057,..,2007,63.42,2007,,,,,,,,,,,,,,,,,,,,,
China,2007,Bayanchuoer Wind Farm Project Phase I,Construction,Energy,2037,..,2007,64.47,2007,,,,,,,,,,,,,,,,,,,,,
China,2007,Dali City Dafeng Dam Wind Farm Project,Operational,Energy,2027,..,2007,61.76,2007,,,,,,,,,,,,,,,,,,,,,
China,2007,Datang Ruifeng Datong Wind Farm Project,Construction,Energy,2037,Local,2007,64.47,2007,,,,,,,,,,,,,,,,,,,,,
China,2007,Datang Ruifeng Xiangyang Wind Farm Project Phase I,Construction,Energy,,Local,2007,75.0,2007,,,,,,,,,,,,,,,,,,,,,
China,2007,Erlianhaote Changfeng Xiehe Wind Farm Project,Construction,Energy,2037,..,2007,30.26,2007,,,,,,,,,,,,,,,,,,,,,
China,2007,Fuxin United Wind Farm Project,Construction,Energy,2037,..,2007,47.96,2007,,,,,,,,,,,,,,,,,,,,,
China,2007,Guohua Ruifeng Hekou Wind Farm Project,Construction,Energy,2027,Local,2007,75.0,2007,,,,,,,,,,,,,,,,,,,,,
China,2007,Guohua Ruifeng Lijin Wind Farm Project Phase I,Construction,Energy,2027,Local,2007,65.79,2007,,,,,,,,,,,,,,,,,,,,,
China,2007,Guohua Ruifeng Zhanhua Wind Farm Project Phase I,Construction,Energy,2027,Local,2007,63.16,2007,,,,,,,,,,,,,,,,,,,,,
China,2007,Huanghua City Wind Farm Project,Construction,Energy,2037,Local,2007,69.74,2007,,,,,,,,,,,,,,,,,,,,,
China,2007,Taipusi Shenhua Xiehe Wind Farm Project,Construction,Energy,2037,..,2007,52.24,2007,,,,,,,,,,,,,,,,,,,,,
China,2007,Taizhou City Dachen Island Wind Farm Project,Construction,Energy,2057,Local,2007,33.46,2007,,,,,,,,,,,,,,,,,,,,,
China,2007,Wulang River Hydro Power Development,Operational,Energy,2027,Local,2007,80.16,2007,,,,,,,,,,,,,,,,,,,,,
China,2007,Yangjiang Hailin Island Wind Farm Project Phase I,Construction,Energy,2057,..,2007,28.17,2007,,,,,,,,,,,,,,,,,,,,,
China,2007,Zhenlai County Wind Farm Project Phase I,Construction,Energy,2037,..,2007,59.21,2007,,,,,,,,,,,,,,,,,,,,,
China,2007,Zhongjieneng Wind Power (Zhangbei) Company Limited,Construction,Energy,2032,..,2007,211.18,2007,,,,,,,,,,,,,,,,,,,,,
China,2008,Ganzi Jiulong River Hydro Power Plant,Construction,Energy,2052,State/Provincial,2008,276.0,2008,,,,,,,,,,,,,,,,,,,,,
China,2008,Guohua Hulunbeier Wind Farm Project phase I,Operational,Energy,2048,Federal,2008,12.27,2008,,,,,,,,,,,,,,,,,,,,,
China,2008,Houxinqiu Mazong Mount Wind Farm Project,Construction,Energy,2038,State/Provincial,2008,76.08,2008,,,,,,,,,,,,,,,,,,,,,
China,2008,Huanghua Wind Farm Project Phase II,Construction,Energy,2033,Federal,2008,74.22,2008,,,,,,,,,,,,,,,,,,,,,
China,2008,Qujiagou Wind Farm Phase I,Construction,Energy,2038,State/Provincial,2008,68.1,2008,,,,,,,,,,,,,,,,,,,,,
China,2008,Siziwang Qi Wind Farm Project,Construction,Energy,2028,State/Provincial,2008,68.67,2008,,,,,,,,,,,,,,,,,,,,,
China,2009,China Longyuan Power Group Corporation Ltd,Operational,Energy,,State/Provincial,2009,2270.0,2009,,,,,,,,,,,,,,,,,,,,,
China,2009,Dezhou Solid Waste Power Plant Project,Operational,Energy,Not Applicable,Local,2009,38.21,2009,,,,,,,,,,,,,,,,,,,,,
China,2009,Fengdu County Biomass Power Plant,Construction,Energy,2039,Local,2009,73.21,2009,,,,,,,,,,,,,,,,,,,,,
China,2009,Jiangxi Risun Solar Energy Technology Xinyu Xiacun PV Plant,Operational,Energy,Not Available,Local,2009,13.11,2009,,,,,,,,,,,,,,,,,,,,,
China,2009,Linjiang Incineration Plant Phase II,Construction,Energy,2036,Local,2009,45.78,2009,,,,,,,,,,,,,,,,,,,,,
China,2009,Nanchang City Quanling Household Waste Incineration Power Plant,Construction,Energy,2036,Local,2009,70.28,2009,,,,,,,,,,,,,,,,,,,,,
China,2009,Tianshui City Four Biomass Power Plant Projects,Construction,Energy,2029,Local,2009,468.52,2009,,,,,,,,,,,,,,,,,,,,,
China,2010,Delixi & CHKO Leqing Liushi Waste-to-Energy Plant,Construction,Energy,Not Available,Local,2010,51.5,2010,,,,,,,,,,,,,,,,,,,,,
China,2010,Gansu Guazhou Xiehe Wind Power Project,Operational,Energy,2036,Federal,2010,249.0,2010,,,,,,,,,,,,,,,,,,,,,
China,2010,Jilin Taobei Baoshan Wind Farm Project,Construction,Energy,Not Applicable,State/Provincial,2010,58.06,2010,,,,,,,,,,,,,,,,,,,,,
China,2010,Shenzhen Topray Pucheng Solar PV Plant,Operational,Energy,Not Available,Local,2010,51.81,2010,,,,,,,,,,,,,,,,,,,,,
China,2010,Yuanmushan Hydro Power Plant,Construction,Energy,Not Available,State/Provincial,2010,25.67,2010,,,,,,,,,,,,,,,,,,,,,
China,2011,Dejiang County Biomass Power Project,Construction,Energy,Not Available,Local,2011,45.85,2011,,,,,,,,,,,,,,,,,,,,,
China,2011,Fujian Lianjiang Saite Tianying Solid Waste Power Plant,Construction,Energy,2041,Local,2011,35.76,2011,,,,,,,,,,,,,,,,,,,,,
China,2011,Geermu Shanyizhongchuan PV Plant,Operational,Energy,Not Available,Local,2011,22.01,2011,,,,,,,,,,,,,,,,,,,,,
China,2011,Guangdong Shantou Nanao Nanya Wind Farm Upgrade Project,Construction,Energy,Not Available,Local,2011,46.83,2011,,,,,,,,,,,,,,,,,,,,,
China,2011,Guangxi Taijiang Wind Farm Project Phase I,Construction,Energy,Not Available,Local,2011,79.47,2011,,,,,,,,,,,,,,,,,,,,,
China,2011,Hunan Longhui Biomass Power Plant,Operational,Energy,Not Available,Local,2011,45.98,2011,,,,,,,,,,,,,,,,,,,,,
China,2011,Inner Mongolia Bayannur Wuyuan Huaxin Biomass Plant Project,Construction,Energy,Not Available,Local,2011,32.57,2011,,,,,,,,,,,,,,,,,,,,,
China,2011,Inner Mongolia Chenbaerhu Qi Guohua AES Wind Farm Phase I,Construction,Energy,Not Available,Local,2011,72.2,2011,,,,,,,,,,,,,,,,,,,,,
China,2011,Inner Mongolia Guigang Shengtai Wind Farm Project,Construction,Energy,Not Available,Local,2011,61.13,2011,,,,,,,,,,,,,,,,,,,,,
China,2011,Inner Mongolia Taipusiqi Toushijian Shenhua Xiehe Wind Farm Power Plant Phase I,Construction,Energy,Not Available,Local,2011,68.01,2011,,,,,,,,,,,,,,,,,,,,,
China,2011,Inner Mongolia Xinganmeng Haili Jinmangha Wind Farm Project Phase I,Construction,Energy,Not Available,Local,2011,76.41,2011,,,,,,,,,,,,,,,,,,,,,
China,2011,Jiangsu Jintan Changzhou Eging PV Plant,Operational,Energy,Not Available,Local,2011,12.23,2011,,,,,,,,,,,,,,,,,,,,,
China,2011,Jilin Baicheng Taobei Baoshan Ao Lu Jia Wind Farm Phase II,Construction,Energy,Not Available,Local,2011,76.41,2011,,,,,,,,,,,,,,,,,,,,,
China,2011,Jilin Heiyupao Jilin Power-Xiehe Wind Farm Phase III,Operational,Energy,Not Available,Local,2011,71.5,2011,,,,,,,,,,,,,,,,,,,,,
China,2011,Jilin Heiyupao Jilin Power-Xiehe Wind Farm Phase IV,Operational,Energy,Not Available,Local,2011,77.4,2011,,,,,,,,,,,,,,,,,,,,,
China,2011,Liaoning Jianping Wanjiayingzi Xiehe Wind Farm,Construction,Energy,Not Available,Local,2011,74.88,2011,,,,,,,,,,,,,,,,,,,,,
China,2011,Liaoning Jinzhou Beijing Tellhow Solar PV Plant,Operational,Energy,Not Available,Local,2011,9.0,2011,,,,,,,,,,,,,,,,,,,,,
China,2011,Liaoyuan City Solid Waste Power Plant,Construction,Energy,Not Available,Local,2011,48.9,2011,,,,,,,,,,,,,,,,,,,,,
China,2011,New Energy Investment Dabancheng PV Plant,Construction,Energy,2036,Local,2011,30.0,2011,,,,,,,,,,,,,,,,,,,,,
China,2011,Ningxia Taiyangshan Zhengtai 10MW PV Power Plant,Operational,Energy,Not Available,Local,2011,33.94,2011,,,,,,,,,,,,,,,,,,,,,
China,2011,Ningxia Yanchi Gaoshawo Hanas STEG Plant,Construction,Energy,Not Available,Local,2011,122.26,2011,,,,,,,,,,,,,,,,,,,,,
China,2011,Ningxia Yanchi Wanglejing Wind Farm Project Phase I,Operational,Energy,Not Available,Local,2011,76.41,2011,,,,,,,,,,,,,,,,,,,,,
China,2011,Qinghai Delingha Baike PV Plant,Operational,Energy,Not Available,Local,2011,53.37,2011,,,,,,,,,,,,,,,,,,,,,
China,2011,Qinghai Delingha China Windpower PV Plant,Operational,Energy,Not Available,Local,2011,90.0,2011,,,,,,,,,,,,,,,,,,,,,
China,2011,Qinghai Delingha Linuo PV Plant,Operational,Energy,Not Available,Local,2011,91.69,2011,,,,,,,,,,,,,,,,,,,,,
China,2011,Qinghai Geermu Solargiga PV Plant,Operational,Energy,Not Available,Local,2011,54.56,2011,,,,,,,,,,,,,,,,,,,,,
China,2011,Qinghai Shenguang PV Plant Phase I,Operational,Energy,Not Available,Local,2011,9.0,2011,,,,,,,,,,,,,,,,,,,,,
China,2011,Shandan County Xiuhuamiao Wind Farm Project,Construction,Energy,Not Available,Local,2011,64.19,2011,,,,,,,,,,,,,,,,,,,,,
China,2011,Shandong Yantai Zhuangzi Runfeng Wind Farm Power Plant,Operational,Energy,Not Available,Local,2011,71.83,2011,,,,,,,,,,,,,,,,,,,,,
China,2011,Shanghai Chongming Beiyan Wind Farm Project,Construction,Energy,Not Available,Local,2011,77.16,2011,,,,,,,,,,,,,,,,,,,,,
China,2011,Tianchang Gaoyou Lake Wind Farm Project,Construction,Energy,Not Available,Local,2011,100.0,2011,,,,,,,,,,,,,,,,,,,,,
China,2011,Tibet Sangri Suntech PV Plant,Operational,Energy,Not Available,Local,2011,38.02,2011,,,,,,,,,,,,,,,,,,,,,
China,2011,Tibet Xigaze Linuo PV Plant Project Phase I,Operational,Energy,Not Available,Local,2011,38.05,2011,,,,,,,,,,,,,,,,,,,,,
China,2011,Zhejiang Lanxi Solid Waste Power Plant,Construction,Energy,Not Applicable,Local,2011,27.51,2011,,,,,,,,,,,,,,,,,,,,,
China,2011,Zoucheng City UMC 20MW Thin Film PV Power Plant (Phase I),Operational,Energy,2036,Local,2011,70.9,2011,,,,,,,,,,,,,,,,,,,,,
China,2012,Baicheng County Ahebulong 1st Cascade Hydropower Station,Construction,Energy,Not Available,Local,2012,21.08,2012,,,,,,,,,,,,,,,,,,,,,
China,2012,Binzhou Tiandiyuan Biomass Power Plant,Operational,Energy,Not Available,Local,2012,69.57,2012,,,,,,,,,,,,,,,,,,,,,
China,2012,Chibi City Liushanhu Town Biomass Power Plant,Construction,Energy,Not Available,Local,2012,51.69,2012,,,,,,,,,,,,,,,,,,,,,
China,2012,China WindPower Gaoyouhu Wind Farm Phase I,Operational,Energy,Not Available,Local,2012,64.43,2012,,,,,,,,,,,,,,,,,,,,,
China,2012,De???an Biomass Power Plant,Construction,Energy,Not Available,Local,2012,47.5,2012,,,,,,,,,,,,,,,,,,,,,
China,2012,Jiangsu Changzhou Trina PV Plant,Operational,Energy,Not Available,Local,2012,0.0,2012,,,,,,,,,,,,,,,,,,,,,
China,2012,Pingyang County Jinan Qiquan Biomass Power Plant,Operational,Energy,Not Available,Local,2012,35.6,2012,,,,,,,,,,,,,,,,,,,,,
China,2012,Yangjiang Hanergy Roof PV Plant Demonstration Project,Construction,Energy,Not Available,Local,2012,12.96,2012,,,,,,,,,,,,,,,,,,,,,
China,2012,Yili Zhenfa 30MW PV Plant Phase I,Construction,Energy,Not Available,Local,2012,63.39,2012,,,,,,,,,,,,,,,,,,,,,
China,2012,Yongshun County Biomass Power Plant,Construction,Energy,Not Available,Local,2012,48.65,2012,,,,,,,,,,,,,,,,,,,,,
China,2012,Yongxin County Biomass Power Plant,Construction,Energy,Not Available,Local,2012,44.37,2012,,,,,,,,,,,,,,,,,,,,,
Indonesia,1994,Karaha Bodas Company,Canceled,Energy,1998,..,1994,380.0,1994,,,,,,,,,,,,,,,,,,,,,
Indonesia,1996,Dieng Geothermal Power Plant,Canceled,Energy,2001,..,1996,450.0,1996,,,,,,,,,,,,,,,,,,,,,
Indonesia,1996,Gunung Salak Geothermal Power Plant,Operational,Energy,,Federal,1996,434.0,1996,,,,,,,,,,,,,,,,,,,,,
Indonesia,1996,Gunung Salak Geothermal Power Plant,Operational,Energy,,Federal,2009,0.0,2009,,,,,,,,,,,,,,,,,,,,,
Indonesia,1997,Darajat Geothermal Power Plant,Operational,Energy,,..,1997,125.0,1997,,,,,,,,,,,,,,,,,,,,,
Indonesia,1997,Darajat Geothermal Power Plant,Operational,Energy,,..,1999,125.0,1999,,,,,,,,,,,,,,,,,,,,,
Indonesia,1997,Darajat Geothermal Power Plant,Operational,Energy,,..,2004,128.0,2004,,,,,,,,,,,,,,,,,,,,,
Indonesia,1997,Patuha Power Ltd.,Canceled,Energy,1998,..,1997,650.0,1997,,,,,,,,,,,,,,,,,,,,,
Indonesia,1998,Wayang Windu Power Project,Operational,Energy,,..,1998,330.0,1998,,,,,,,,,,,,,,,,,,,,,
Indonesia,1998,Wayang Windu Power Project,Operational,Energy,,..,2007,305.0,2007,,,,,,,,,,,,,,,,,,,,,
Indonesia,1998,Wayang Windu Power Project,Operational,Energy,,..,2008,450.0,2008,,,,,,,,,,,,,,,,,,,,,
Indonesia,2004,Bedugul Geothermal Power Plant,Construction,Energy,2036,Local,2004,0.0,2004,,,,,,,,,,,,,,,,,,,,,
Indonesia,2006,Asahan-I Hydropower plant,Operational,Energy,2042,Federal,2006,270.0,2006,,,,,,,,,,,,,,,,,,,,,
Indonesia,2006,Sibayak Geothermal Power Plant,Construction,Energy,,Federal,2006,14.6,2006,,,,,,,,,,,,,,,,,,,,,
Indonesia,2008,PLTA Poso,Operational,Energy,2040,Federal,2008,134.0,2008,,,,,,,,,,,,,,,,,,,,,
Indonesia,2011,Atadei Geothermal Power Plant,Construction,Energy,Not Available,Federal,2011,35.0,2011,,,,,,,,,,,,,,,,,,,,,
Indonesia,2012,Bina Puri Desa Patteneteang SHPP,Construction,Energy,,Federal,2012,10.0,2012,,,,,,,,,,,,,,,,,,,,,
Indonesia,2012,KOMIPO Wampu SHPP,Construction,Energy,2045,Federal,2012,174.0,2012,,,,,,,,,,,,,,,,,,,,,
Indonesia,2012,SGI-Mitabu Solar Plant Phase I,Construction,Energy,,Federal,2012,104.0,2012,,,,,,,,,,,,,,,,,,,,,
Lao PDR,1996,Houay Ho Hydro Power Project,Operational,Energy,2026,..,1996,220.0,1996,,,,,,,,,,,,,,,,,,,,,
Lao PDR,1996,Theun Hinboun Hydro Power Plant I,Operational,Energy,2026,..,1996,315.5,1996,,,,,,,,,,,,,,,,,,,,,
Lao PDR,1996,Theun Hinboun Hydro Power Plant I,Operational,Energy,2026,..,2008,665.0,2008,,,,,,,,,,,,,,,,,,,,,
Lao PDR,2005,Nam Theun II Hydropower Project,Operational,Energy,2034,Federal,2005,1250.0,2005,,,,,,,,,,,,,,,,,,,,,
Lao PDR,2006,Nam Ngum 2 Hydro Power Plant,Operational,Energy,2034,Federal,2006,760.0,2006,,,,,,,,,,,,,,,,,,,,,
Lao PDR,2006,Xekaman 3 Hydropower Plant,Construction,Energy,2041,Federal,2006,310.0,2006,,,,,,,,,,,,,,,,,,,,,
Lao PDR,2008,Nam Ngum 5 Hydropower Plant,Construction,Energy,,..,2008,200.0,2008,,,,,,,,,,,,,,,,,,,,,
Lao PDR,2008,Nam Nhone Hydropower Plant,Construction,Energy,Not Applicable,Federal,2008,4.5,2008,,,,,,,,,,,,,,,,,,,,,
Lao PDR,2010,Nam Lik 1-2 Hydropower Plant,Operational,Energy,2035,Federal,2010,150.0,2010,,,,,,,,,,,,,,,,,,,,,
Lao PDR,2011,Luanggpaseuth Nam Long SHPP,Construction,Energy,Not Available,Federal,2011,10.0,2011,,,,,,,,,,,,,,,,,,,,,
Lao PDR,2011,Viet-Laos Xekaman I HPP,Construction,Energy,2044,Federal,2011,441.6,2011,,,,,,,,,,,,,,,,,,,,,
Lao PDR,2012,HAG Nam Kong II HPP,Construction,Energy,,Federal,2012,71.42,2012,,,,,,,,,,,,,,,,,,,,,
Lao PDR,2012,Sinohydro Nam Khan II & III HPP,Construction,Energy,Not Available,Federal,2012,430.0,2012,,,,,,,,,,,,,,,,,,,,,
Malaysia,1993,Serudong Power Sdn Bhd (Tawau),Operational,Energy,,..,1993,78.0,1993,,,,,,,,,,,,,,,,,,,,,
Malaysia,2001,Bumibiopower Biomass Power Plant Project,Operational,Energy,,Federal,2001,7.0,2001,,,,,,,,,,,,,,,,,,,,,
Malaysia,2001,Sungai Kenerong Hydro Power Plant,Operational,Energy,2030,..,2001,28.4,2001,,,,,,,,,,,,,,,,,,,,,
Malaysia,2002,"THS Bio-Energy Cogeneration Plant, Kunak",Operational,Energy,2021,Federal,2002,12.3,2002,,,,,,,,,,,,,,,,,,,,,
Malaysia,2006,Sandakan-1 and Seguntor Biomass Power Plants,Operational,Energy,,Federal,2006,48.0,2006,,,,,,,,,,,,,,,,,,,,,
Malaysia,2011,Cypark-LG Negeri Sembilan Solar Plant,Operational,Energy,2033,State/Provincial,2011,24.0,2011,,,,,,,,,,,,,,,,,,,,,
Malaysia,2012,Felda Global Jenka Biomass Plant,Operational,Energy,2034,Federal,2012,36.0,2012,,,,,,,,,,,,,,,,,,,,,
Mongolia,2012,Newcom Salkhit Wind Farm,Construction,Energy,Not Available,Federal,2012,120.0,2012,,,,,,,,,,,,,,,,,,,,,
Myanmar,2006,Nanli 1-2 Hydropower Station,Construction,Energy,2036,..,2006,142.0,2006,,,,,,,,,,,,,,,,,,,,,
Myanmar,2006,Shweli River Cascade 1 Hydropower Station,Operational,Energy,2046,Federal,2006,414.1,2006,,,,,,,,,,,,,,,,,,,,,
Philippines,1992,Benguet Province Hydro Plant,Operational,Energy,,..,1992,45.0,1992,,,,,,,,,,,,,,,,,,,,,
Philippines,1993,Binga Hydro Power Plant,Operational,Energy,2000,Federal,1993,52.5,1993,,,,,,,,,,,,,,,,,,,,,
Philippines,1993,Mahiao Geothermal Power Plant,Concluded,Energy,2006,..,1993,273.0,1993,,,,,,,,,,,,,,,,,,,,,
Philippines,1994,Mahanagdong Geothermal Power Plant,Concluded,Energy,2007,..,1994,320.0,1994,,,,,,,,,,,,,,,,,,,,,
Philippines,1994,Makban Binary Geothermal Plant,Concluded,Energy,2004,..,1994,17.0,1994,,,,,,,,,,,,,,,,,,,,,
Philippines,1995,Ambuklao Hydro Power Plant,Concluded,Energy,2000,..,1995,36.2,1995,,,,,,,,,,,,,,,,,,,,,
Philippines,1995,Malitbog Geothermal Power,Concluded,Energy,2007,..,1995,280.0,1995,,,,,,,,,,,,,,,,,,,,,
Philippines,1995,Mindanao 1 & 2,Operational,Energy,2020,..,1995,67.0,1995,,,,,,,,,,,,,,,,,,,,,
Philippines,1995,Mindanao 1 & 2,Operational,Energy,2020,..,1996,60.0,1996,,,,,,,,,,,,,,,,,,,,,
Philippines,1996,CE Casecnan Power and Water Project,Operational,Energy,,..,1996,495.0,1996,,,,,,,,,,,,,,,,,,,,,
Philippines,1996,Leyte Geothermal Optimization Project,Concluded,Energy,2007,..,1996,70.0,1996,,,,,,,,,,,,,,,,,,,,,
Philippines,1997,Bakun River Power Plant,Operational,Energy,2022,..,1997,145.0,1997,,,,,,,,,,,,,,,,,,,,,
Philippines,1997,Bakun River Power Plant,Operational,Energy,2022,..,2004,10.0,2004,,,,,,,,,,,,,,,,,,,,,
Philippines,1998,San Roque Hydropower Project,Operational,Energy,2023,..,1998,1100.0,1998,,,,,,,,,,,,,,,,,,,,,
Philippines,2001,CBK Power Co.,Operational,Energy,2026,Federal,2001,530.0,2001,,,,,,,,,,,,,,,,,,,,,
Philippines,2001,CBK Power Co.,Operational,Energy,2026,Federal,2003,0.0,2003,,,,,,,,,,,,,,,,,,,,,
Philippines,2003,Cagayan de Oro Solar Power Project,Operational,Energy,,Local,2003,5.3,2003,,,,,,,,,,,,,,,,,,,,,
Philippines,2004,Agusan Hydroelectric Power Plant,Operational,Energy,,Federal,2004,1.5,2004,,,,,,,,,,,,,,,,,,,,,
Philippines,2004,Bangui Bay Wind Power Project,Operational,Energy,2029,Federal,2004,38.0,2004,,,,,,,,,,,,,,,,,,,,,
Philippines,2004,Bangui Bay Wind Power Project,Operational,Energy,2029,Federal,2007,13.0,2007,,,,,,,,,,,,,,,,,,,,,
Philippines,2004,Barit Hydroelectric Plant,Operational,Energy,,Federal,2004,0.48,2004,,,,,,,,,,,,,,,,,,,,,
Philippines,2004,Cawayan Hydroelectric Plant,Operational,Energy,,Federal,2004,0.41,2004,,,,,,,,,,,,,,,,,,,,,
Philippines,2004,First Gen Agusan SHPP,Operational,Energy,,Federal,2004,1.0,2004,,,,,,,,,,,,,,,,,,,,,
Philippines,2004,Loboc Hydroelectric Power Plant,Operational,Energy,,Federal,2004,1.42,2004,,,,,,,,,,,,,,,,,,,,,
Philippines,2004,Talisay cogeneration plant,Operational,Energy,2036,Federal,2004,60.0,2004,,,,,,,,,,,,,,,,,,,,,
Philippines,2004,Talomo Hydroelectric Plant,Operational,Energy,,Federal,2004,1.3,2004,,,,,,,,,,,,,,,,,,,,,
Philippines,2006,3iPowergen,Operational,Energy,,Federal,2006,24.8,2006,,,,,,,,,,,,,,,,,,,,,
Philippines,2006,Energy Development Co (EDC),Operational,Energy,Not Applicable,Federal,2006,384.0,2006,,,,,,,,,,,,,,,,,,,,,
Philippines,2006,Energy Development Co (EDC),Operational,Energy,Not Applicable,Federal,2007,1400.0,2007,,,,,,,,,,,,,,,,,,,,,
Philippines,2006,Pantabangan - Masiway Hydroelectric Power Plant,Operational,Energy,,Federal,2006,129.0,2006,,,,,,,,,,,,,,,,,,,,,
Philippines,2007,Magat Hydroelectric Plant,Operational,Energy,,Federal,2007,530.0,2007,,,,,,,,,,,,,,,,,,,,,
Philippines,2008,Ambuklao-Binga Hydroelectric Power Complex,Operational,Energy,Not Applicable,Federal,2008,495.0,2008,,,,,,,,,,,,,,,,,,,,,
Philippines,2008,Ambuklao-Binga Hydroelectric Power Complex,Operational,Energy,Not Applicable,Federal,2012,55.0,2012,,,,,,,,,,,,,,,,,,,,,
Philippines,2008,Hedcor Sibulan hydro plants,Operational,Energy,Not Available,State/Provincial,2008,105.0,2008,,,,,,,,,,,,,,,,,,,,,
Philippines,2008,Hedcor Sibulan hydro plants,Operational,Energy,Not Available,State/Provincial,2009,22.89,2009,,,,,,,,,,,,,,,,,,,,,
